{
  "entries": [
    {
      "content_sha256": "0cca8773ce069d333c9e5f64d062115042f0ece5e40b56b7da14a68a0aa7074b",
      "package_path": "evidence/bundled/atlas.json",
      "source_blob_sha": "8ecfe398f8fad1a33c8ee6454fd10ce313afd43d",
      "source_path": "results/20260401/candidate_b_minlib_granularity/bundled/atlas.json"
    },
    {
      "content_sha256": "955e6bb4e55a557613444b754a51137af73e98fc3bb7a8c8ba3bfc01f8c859b2",
      "package_path": "evidence/bundled/case_00000/sen24.manifest.json",
      "source_blob_sha": "30cc68125ddece305c8ed851fac90f875de210a9",
      "source_path": "results/20260401/candidate_b_minlib_granularity/bundled/case_00000/sen24.manifest.json"
    },
    {
      "content_sha256": "91a6c3f4ac2bde9d0e8fcc1f64a74413318657397aff94e43e247a73d2ab4da6",
      "package_path": "evidence/bundled/case_00000/summary.json",
      "source_blob_sha": "377b53397008c250c35ca30a122cbdbbdfbfb791",
      "source_path": "results/20260401/candidate_b_minlib_granularity/bundled/case_00000/summary.json"
    },
    {
      "content_sha256": "d3d0c06ce0095c912cd313c503eb95876e9392ed91734e9dc8c68089c1fe876f",
      "package_path": "evidence/bundled/case_00001/sen24.manifest.json",
      "source_blob_sha": "fc96a2e4fc66aa84a95cc0dceab261c1d64634cf",
      "source_path": "results/20260401/candidate_b_minlib_granularity/bundled/case_00001/sen24.manifest.json"
    },
    {
      "content_sha256": "d7248ab9c8382e65146cb16f607d898f51d545f37e3768b0990349c2e24db0bd",
      "package_path": "evidence/bundled/case_00001/summary.json",
      "source_blob_sha": "0089c3c3ece68c5db40249889364ba52e75a1ab4",
      "source_path": "results/20260401/candidate_b_minlib_granularity/bundled/case_00001/summary.json"
    },
    {
      "content_sha256": "9bf95cbbf9603919a8aada86992ed736824648d1cb5f48317ad6b7af1161a88b",
      "package_path": "evidence/bundled/case_00100/sen24.manifest.json",
      "source_blob_sha": "cd028454cb732acfd3276f5df32d294cffc6fc44",
      "source_path": "results/20260401/candidate_b_minlib_granularity/bundled/case_00100/sen24.manifest.json"
    },
    {
      "content_sha256": "9622b5a2828a4a8d5caf5fb4a1d2b411cbeeb44961a19beeeb2c377881c0b67c",
      "package_path": "evidence/bundled/case_00100/summary.json",
      "source_blob_sha": "efbf21b905e6290842d96532c20dfcc66aa3a70b",
      "source_path": "results/20260401/candidate_b_minlib_granularity/bundled/case_00100/summary.json"
    },
    {
      "content_sha256": "f1c0e2f5f3bbf8c25e9423e3a30c8c81695cf61d4a8976fbeac863fb71c1115a",
      "package_path": "evidence/bundled/case_00101/sen24.manifest.json",
      "source_blob_sha": "8ce850918420ede47a52e7ed25ec8f607b4e397a",
      "source_path": "results/20260401/candidate_b_minlib_granularity/bundled/case_00101/sen24.manifest.json"
    },
    {
      "content_sha256": "8f2596f6f67572acd8e45e5e82e99224969c1e2ceaa3eecdfdc93784e2ca2ceb",
      "package_path": "evidence/bundled/case_00101/summary.json",
      "source_blob_sha": "8847f29303120abc69b51e20874d42dd89431747",
      "source_path": "results/20260401/candidate_b_minlib_granularity/bundled/case_00101/summary.json"
    },
    {
      "content_sha256": "72061161715f1dd3bb7824925977ec64b3a6b82be7d6fcd920f173436704a06b",
      "package_path": "evidence/bundled/case_01000/sen24.manifest.json",
      "source_blob_sha": "71f8ee209189158e2c746808c3d4d70fa3ef4917",
      "source_path": "results/20260401/candidate_b_minlib_granularity/bundled/case_01000/sen24.manifest.json"
    },
    {
      "content_sha256": "6d878b3e237863681e2522de3680a3af641b58dbef86c56c96b0f9b58b23fd9c",
      "package_path": "evidence/bundled/case_01000/summary.json",
      "source_blob_sha": "a353bd9cd14bf95a6343bee07c36e2ac996c62f0",
      "source_path": "results/20260401/candidate_b_minlib_granularity/bundled/case_01000/summary.json"
    },
    {
      "content_sha256": "6fa086bf8d61a686bcf40917b067a664f82f7f0343af2de2d187de1f81c842a9",
      "package_path": "evidence/bundled/case_01001/sen24.manifest.json",
      "source_blob_sha": "4f7f00e199b6756c1a566ec6c574f1389dae3e26",
      "source_path": "results/20260401/candidate_b_minlib_granularity/bundled/case_01001/sen24.manifest.json"
    },
    {
      "content_sha256": "45af26a8821e75d24d380709c1b20b562bd29685f7a9af3e4e1aa61a132ecf8d",
      "package_path": "evidence/bundled/case_01001/summary.json",
      "source_blob_sha": "a5062f3d022e3295012f55d1776a19b9f4c80629",
      "source_path": "results/20260401/candidate_b_minlib_granularity/bundled/case_01001/summary.json"
    },
    {
      "content_sha256": "2eff686cb38524c27e8b182e03390fb0df98c0d85bd56a4bf84c8df96c0f479f",
      "package_path": "evidence/bundled/case_01100/sen24.manifest.json",
      "source_blob_sha": "3b770f98807f67bc5cb4277d04fb8b379b3fafce",
      "source_path": "results/20260401/candidate_b_minlib_granularity/bundled/case_01100/sen24.manifest.json"
    },
    {
      "content_sha256": "a8ad2af5316424fe59b866e2806b7298415d35033e02e37f147c7d197e7fe2b5",
      "package_path": "evidence/bundled/case_01100/summary.json",
      "source_blob_sha": "1ff3eb07bfa01fc645a04cd5c55e3cf102582faa",
      "source_path": "results/20260401/candidate_b_minlib_granularity/bundled/case_01100/summary.json"
    },
    {
      "content_sha256": "90df94d8a41c53b574c5c89a0117fa44700251f93c0ed3ac437efbb1c2d70344",
      "package_path": "evidence/bundled/case_01101/sen24.manifest.json",
      "source_blob_sha": "d2abc75b8f380d8f064f84f9cf76a51000768d14",
      "source_path": "results/20260401/candidate_b_minlib_granularity/bundled/case_01101/sen24.manifest.json"
    },
    {
      "content_sha256": "c0ff3f39e59a1ab57ce0584c120acc5394ab7c9de4e94950b21c1f313944d111",
      "package_path": "evidence/bundled/case_01101/summary.json",
      "source_blob_sha": "0910c53869af4c421cc0843d7799a7c84482dd3e",
      "source_path": "results/20260401/candidate_b_minlib_granularity/bundled/case_01101/summary.json"
    },
    {
      "content_sha256": "282cf543580bce17c12cef6df5224ad7bdfcaa679ea5160d252db271306f2656",
      "package_path": "evidence/bundled/case_10000/sen24.manifest.json",
      "source_blob_sha": "d2bb8973ad4d3f7f44a430ad8c10921539fd1ae5",
      "source_path": "results/20260401/candidate_b_minlib_granularity/bundled/case_10000/sen24.manifest.json"
    },
    {
      "content_sha256": "d29e9d2e01ea45e2b8908884e009612550b0946440856ea1b50363a797bc8086",
      "package_path": "evidence/bundled/case_10000/summary.json",
      "source_blob_sha": "9269c7262c33fb657bc98ceeb15c426a2d4d648a",
      "source_path": "results/20260401/candidate_b_minlib_granularity/bundled/case_10000/summary.json"
    },
    {
      "content_sha256": "cd1490c6054e4acd2a9e3724d07a3e4a5d4530290ce6a9b253e54d4d2b50c8f2",
      "package_path": "evidence/bundled/case_10001/sen24.manifest.json",
      "source_blob_sha": "5d9743fb0432b46c764f2ad038568cd68e9ecd77",
      "source_path": "results/20260401/candidate_b_minlib_granularity/bundled/case_10001/sen24.manifest.json"
    },
    {
      "content_sha256": "ad52486addcf5e9e7afd410c614a6588e72cd419613a069278844cd89a537a5e",
      "package_path": "evidence/bundled/case_10001/summary.json",
      "source_blob_sha": "aab5c77e595c6e8993ab53390318950c98cdef4e",
      "source_path": "results/20260401/candidate_b_minlib_granularity/bundled/case_10001/summary.json"
    },
    {
      "content_sha256": "cac5040135c83cf10853ca579739d6cb151b2f3d80807211c04c0b5ddf190c9f",
      "package_path": "evidence/bundled/case_10100/sen24.manifest.json",
      "source_blob_sha": "a494dfcf3290d4c77c3e4f9958318970510299e3",
      "source_path": "results/20260401/candidate_b_minlib_granularity/bundled/case_10100/sen24.manifest.json"
    },
    {
      "content_sha256": "cbe572ce41e3a72c7a25240ff1fa5a8b0447dad6cc3e20f977eb2fa9385498a3",
      "package_path": "evidence/bundled/case_10100/summary.json",
      "source_blob_sha": "04fee46d5a964da11f71da38cd67f474ab68a5ab",
      "source_path": "results/20260401/candidate_b_minlib_granularity/bundled/case_10100/summary.json"
    },
    {
      "content_sha256": "7815724692c6a2a287cb0dce654c2bee318d28eb722765c7e23baa72816db2e2",
      "package_path": "evidence/bundled/case_10101/sen24.manifest.json",
      "source_blob_sha": "4e75150ba74bb58ad579aea415150be03b89495a",
      "source_path": "results/20260401/candidate_b_minlib_granularity/bundled/case_10101/sen24.manifest.json"
    },
    {
      "content_sha256": "34d81bbacf017ee37ecd862cdfca1af3915377f0c30421caa8713bb06a6ebbc0",
      "package_path": "evidence/bundled/case_10101/summary.json",
      "source_blob_sha": "c373cb24b8ce008ec7e11574e509e4fc83d5df1b",
      "source_path": "results/20260401/candidate_b_minlib_granularity/bundled/case_10101/summary.json"
    },
    {
      "content_sha256": "3ec4b1e85ee7c6d025f1028f7e944c5c65c17c350a7dc877244ed36e1fe2923d",
      "package_path": "evidence/bundled/case_11000/sen24.manifest.json",
      "source_blob_sha": "4dc5d9bd72493f18450912e5c5664e1350efab73",
      "source_path": "results/20260401/candidate_b_minlib_granularity/bundled/case_11000/sen24.manifest.json"
    },
    {
      "content_sha256": "715862ebf8ce1f4e7e32e1e94373d143c189f643c7ea17d32b447840a62bf22b",
      "package_path": "evidence/bundled/case_11000/summary.json",
      "source_blob_sha": "e2c14239934034eadfad133ed87ef611111c42f7",
      "source_path": "results/20260401/candidate_b_minlib_granularity/bundled/case_11000/summary.json"
    },
    {
      "content_sha256": "f4a933936b363c048a6b7bcfe2969ec0c4448d669689317b73c879bd7767118a",
      "package_path": "evidence/bundled/case_11001/sen24.manifest.json",
      "source_blob_sha": "e2d56de36d6d5395cf0ec756d32610e9ed0772a3",
      "source_path": "results/20260401/candidate_b_minlib_granularity/bundled/case_11001/sen24.manifest.json"
    },
    {
      "content_sha256": "4fa56fdb48f39a48f13c4e1c1fd67f2645f8ec7bad7af7d6b9bf2f97c518ab65",
      "package_path": "evidence/bundled/case_11001/summary.json",